{
  "$schema": "../../node_modules/@gk0919/agent-workflow/resources/schemas/workflow-profile.schema.json",
  "schemaVersion": 1,
  "extends": "workflow:resources/profiles/default/profile.json",
  "id": "generic-host",
  "description": "generic-host 的项目专属工作流绑定。",
  "governance": {
    "markdownFiles": [
      "AGENTS.md",
      ".agent-workflow/profile/policy.md"
    ]
  },
  "setup": {
    "requiredPaths": [
      ".agent-workflow/profile/policy.md"
    ]
  }
}
