{
  "$schema": "../../../resources/schemas/workflow-profile.schema.json",
  "schemaVersion": 1,
  "extends": "workflow:resources/profiles/default/profile.json",
  "id": "overlay-test",
  "description": "Profile 契约回归使用的项目覆盖层。",
  "issueTracking": {
    "label": "work-item"
  },
  "governance": {
    "markdownFiles": ["AGENTS.md"]
  }
}
